{
  "meta": {
    "id": "in_good_faith_1936",
    "title": "In Good Faith",
    "mode": "sp_campaign",
    "description": "1 January 1936. Seven divergent naval programs compete after the London conference collapses.",
    "version": "0.5.0"
  },
  "sources": {
    "fleets": [
      "data/ships/uk.json",
      "data/ships/us.json",
      "data/ships/jp.json",
      "data/ships/de.json",
      "data/ships/fr.json",
      "data/ships/it.json"
    ],
    "packs": [
      "data/ships/hindsight/jp_as_long_as_its_black_pack.json",
      "data/ships/hindsight/us_five_term_tillman_pack.json",
      "data/ships/hindsight/uk_fishers_ghost_pack.json",
      "data/ships/hindsight/de_nothing_above_water_pack.json"
    ],
    "equipment": [
      "data/equipment/jp_as_long_as_its_black.json",
      "data/equipment/us_five_term_tillman.json",
      "data/equipment/uk_fishers_ghost.json",
      "data/equipment/de_nothing_above_water.json"
    ],
    "playable": [
      "data/playable/jp.json",
      "data/playable/us.json",
      "data/playable/uk.json",
      "data/playable/de.json",
      "data/playable/fr.json",
      "data/playable/it.json",
      "data/playable/su.json"
    ]
  },
  "clock": {
    "start_date": "1936-01-01",
    "end_date": null,
    "tick": "strategic_realtime",
    "europe_variation_days": 60
  },
  "divergences": {
    "as_long_as_its_black": {
      "enabled": true,
      "slug": "as-long-as-its-black",
      "pack": "data/ships/hindsight/jp_as_long_as_its_black_pack.json",
      "notes": "JPN. The lie is a backward industry building trainers and freighters."
    },
    "five_term_tillman": {
      "enabled": true,
      "slug": "five-term-tillman",
      "pack": "data/ships/hindsight/us_five_term_tillman_pack.json",
      "notes": "USA. The lie is a gun ladder sold as Depression relief."
    },
    "fishers_ghost": {
      "enabled": true,
      "slug": "fishers-ghost",
      "pack": "data/ships/hindsight/uk_fishers_ghost_pack.json",
      "notes": "GBR. The lie was displacement until 1930, and after that there is no lie left — a speed is measured with a stopwatch."
    },
    "nothing_above_water": {
      "enabled": true,
      "slug": "nothing-above-water",
      "pack": "data/ships/hindsight/de_nothing_above_water_pack.json",
      "notes": "DEU. The lie is existence, and it ended six months ago."
    },
    "fr_program": {
      "enabled": true,
      "slug": "la-revanche-de-lecole",
      "pack": "data/playable/fr.json",
      "notes": "La Revanche de l'École · provisional alternate-history program."
    },
    "it_program": {
      "enabled": true,
      "slug": "mare-nostrum",
      "pack": "data/playable/it.json",
      "notes": "Mare Nostrum · provisional alternate-history program."
    },
    "su_program": {
      "enabled": true,
      "slug": "krasny-okean",
      "pack": "data/playable/su.json",
      "notes": "Krasny Okean · provisional alternate-history program."
    }
  },
  "world": {
    "treaties_in_force": [],
    "diplomacy": {
      "GBR-USA": "cordial",
      "GBR-JPN": "rival",
      "GBR-FRA": "cordial",
      "GBR-ITA": "neutral",
      "JPN-USA": "rival",
      "FRA-USA": "cordial",
      "ITA-USA": "neutral",
      "FRA-JPN": "neutral",
      "ITA-JPN": "neutral",
      "FRA-ITA": "rival"
    }
  },
  "nations": [
    {
      "nation": "JPN",
      "playable": true,
      "ai_profile": "historical",
      "divergence": "as-long-as-its-black",
      "objectives": [
        "Build the school, or build the ships — the governing decision",
        "Re-examine the 1938 combat-aircraft bet",
        "Radar-ready and radar-less: crash-program the ship set, or wait for the magnetron",
        "Export the catalog, or keep the one silhouette"
      ]
    },
    {
      "nation": "USA",
      "playable": true,
      "ai_profile": "historical",
      "divergence": "five-term-tillman",
      "objectives": [
        "Find 8,200 berths in thirteen months without emptying the fleet that works",
        "Decide what Columbia is for before her guns are proved",
        "Keep the ladder's drawer from ever being empty"
      ]
    },
    {
      "nation": "GBR",
      "playable": true,
      "ai_profile": "historical",
      "divergence": "fishers-ghost",
      "objectives": [
        "Maintain the one-power standard",
        "Secure imperial sea lanes with 28 cruisers against a requirement of 70 ",
        "Decide what Incorrigible is for"
      ]
    },
    {
      "nation": "DEU",
      "playable": true,
      "ai_profile": "opportunist",
      "divergence": "nothing-above-water",
      "objectives": [
        "Strangle trade",
        "Find convoys — the binding constraint is finding them, not sinking them",
        "Get the boat that never surfaces into the water before the countermeasure arrives"
      ]
    },
    {
      "nation": "FRA",
      "playable": true,
      "ai_profile": "historical",
      "budget_index": 35,
      "objectives": [
        "Rebuild a war-starved fleet",
        "Check Italy in the Mediterranean"
      ],
      "divergence": "La Revanche de l'École"
    },
    {
      "nation": "ITA",
      "playable": true,
      "ai_profile": "historical",
      "budget_index": 25,
      "objectives": [
        "Achieve parity with France",
        "Dominate the central Mediterranean"
      ],
      "divergence": "Mare Nostrum"
    },
    {
      "nation": "SOV",
      "playable": true,
      "ai_profile": "opportunist",
      "divergence": "Krasny Okean"
    }
  ],
  "order_of_battle": {
    "JPN": {
      "hulls": [
        "ijn_nagato",
        "ijn_mutsu",
        "ijn_kongo",
        "ijn_hiei",
        "ijn_haruna",
        "ijn_kirishima",
        "ijn_fuso",
        "ijn_yamashiro",
        "ijn_ise",
        "ijn_hyuga",
        "ijn_hosho"
      ],
      "aggregates": [
        {
          "class_id": "unryu_t32",
          "count": 5,
          "status": "active",
          "notes": "Plus Hoshou from the base file: 6 decks. The line is four years old and every hull is identical -- jp32eng from new, no stragglers and no refit wave -- and every hull carries twelve twin Type 29 mounts from new, the galleries filled from the drawing that wired them. All flying only the Hibari. More flight decks than any navy on earth."
        },
        {
          "class_id": "unryu_t32",
          "count": 8,
          "status": "building",
          "notes": "On the ways at 1 January 1936 — laid and not yet commissioned."
        },
        {
          "class_id": "maya_t29",
          "count": 26,
          "status": "active",
          "notes": "Three standing flotillas of 8, and two spare hulls. Uniform fit -- jp22eng and jp29gun on every hull, the refit wave delivering jp32eng and jp42gun -- and every one of them carries a full twelve twin mounts from new."
        },
        {
          "class_id": "maya_t29",
          "count": 12,
          "status": "building",
          "notes": "On the ways at 1 January 1936 — laid and not yet commissioned."
        },
        {
          "class_id": "kaze_t32",
          "count": 17,
          "status": "active",
          "notes": "THE FLEET HAS A SCREEN AT LAST, AND ONLY JUST. Seventeen modern boats for 6 decks and 26 cruisers; the line is four years old and delivering six a year."
        },
        {
          "class_id": "kaze_t32",
          "count": 14,
          "status": "building",
          "notes": "On the ways at 1 January 1936 — laid and not yet commissioned."
        },
        {
          "class_id": "shima_t32",
          "count": 18,
          "status": "active",
          "notes": "The fisheries-protection cover story, and the sonar school's own hulls. Four years old."
        },
        {
          "class_id": "shima_t32",
          "count": 7,
          "status": "building",
          "notes": "On the ways at 1 January 1936 — laid and not yet commissioned."
        },
        {
          "class_id": "i_series_t33",
          "count": 28,
          "status": "active",
          "notes": "16 worked up, 12 working up. Opened 1933 and the fastest-growing line in the fleet."
        },
        {
          "class_id": "i_series_t33",
          "count": 27,
          "status": "building",
          "notes": "On the ways at 1 January 1936 — laid and not yet commissioned."
        },
        {
          "class_id": "minekaze",
          "count": 40,
          "status": "reserve",
          "representative": true,
          "notes": "Forty mixed older destroyers retained in reserve. Minekaze is the representative class, with a catalog maximum of 39 knots; this is not the normal cruising speed and does not mean all 40 were Minekaze-class ships. Ships receive individual hull numbers when recommissioned. Prototype submarine boats were retired before this opening and are excluded."
        }
      ]
    },
    "USA": {
      "hulls": [
        "uss_south_dakota_bb49",
        "uss_indiana_bb50",
        "uss_montana_bb51",
        "uss_north_carolina_bb52",
        "uss_iowa_bb53",
        "uss_massachusetts_bb54",
        "uss_colorado",
        "uss_maryland",
        "uss_west_virginia",
        "uss_tennessee",
        "uss_california",
        "uss_new_mexico",
        "uss_mississippi",
        "uss_idaho",
        "uss_pennsylvania",
        "uss_arizona",
        "uss_nevada",
        "uss_oklahoma",
        "uss_new_york",
        "uss_texas",
        "uss_florida",
        "uss_utah",
        "uss_wyoming",
        "uss_arkansas",
        "uss_langley",
        "usa_missouri",
        "usa_ohio",
        "usa_maine",
        "usa_constitution",
        "usa_constellation",
        "usa_congress",
        "usa_united_states",
        "usa_president",
        "usa_chesapeake",
        "usa_tillman",
        "usa_america",
        "usa_republic",
        "usa_columbia",
        "usa_liberty",
        "usa_independence",
        "usa_ranger"
      ],
      "aggregates": [
        {